{
 "manifest_id": "man_1c6073bfb883f3f5",
 "job_id": "job_1c6073bfb883f3f5",
 "tool": "compute_walk_access",
 "aoi_id": "aoi_z2",
 "baseline_id": "bas_z2_20261001",
 "datasets": [
  {
   "snapshot_id": "snp_osm_pisa_20261001",
   "source_id": "src_osm_pisa",
   "sha256": "69d65bfc52e0daf14ccd57fee67216af9b91d747cdb79841ec2337a2f2b086f5",
   "license_state": "clear"
  },
  {
   "snapshot_id": "snp_sit_civici_20261001",
   "source_id": "src_sit_civici",
   "sha256": "b1acea5703362bc497b8df8afe374ef6864cbd8ad470dd976973fd1be43af915",
   "license_state": "unproven"
  }
 ],
 "params": {
  "destination_ids": [
   "dst_school_piee82101p"
  ],
  "entrance_ids": [
   "ent_osm_n6532183886"
  ],
  "origins": {
   "kind": "civici_sit_z2",
   "count": 2224
  },
  "profile": {
   "speed_m_s": 1.33,
   "crossing_penalty_s": 0,
   "stairs": "allowed",
   "snap_limit_m": 40.0
  },
  "thresholds_min": [
   10.0
  ],
  "deviazione_alta": {
   "ratio": 1.5,
   "min_diretta_m": 100
  },
  "method_version": "0.1.0",
  "graph": {
   "graph_id": "grf_z2_osm_20261001",
   "graph_sha256": "7fffadd58fb079da33b617b987fd14553027889050d753eec86e1177bb087be7",
   "regole_sha256": "7334ecafeafe39ede0654d6cbde541ca0c2c7380c9098a21b3b6c81fd6e8eec3"
  }
 },
 "method": {
  "name": "shortest_path_walk_time",
  "version": "0.1.0",
  "description": "Cammino minimo pesato per tempo (lunghezza su velocità più penalità di attraversamento) sul grafo pedonale OSM congelato, con raccordo registrato dall'origine alla rete."
 },
 "crs": "EPSG:7791",
 "vertical_datum_status": "not_confirmed",
 "timezone": "Europe/Rome",
 "timing": {
  "started_at": "2026-10-01T20:30:57Z",
  "finished_at": "2026-10-01T20:30:57Z",
  "duration_s": 0.46
 },
 "metrics": [
  {
   "metric_id": "origins_total",
   "label": "Origini (civici SIT di Z2)",
   "value": 2224,
   "unit": "count",
   "classification": "derived"
  },
  {
   "metric_id": "origins_reachable",
   "label": "Origini in stato reachable",
   "value": 2148,
   "unit": "count",
   "classification": "derived"
  },
  {
   "metric_id": "origins_isolated",
   "label": "Origini in stato isolated",
   "value": 0,
   "unit": "count",
   "classification": "derived"
  },
  {
   "metric_id": "origins_insufficient_data",
   "label": "Origini in stato insufficient_data",
   "value": 55,
   "unit": "count",
   "classification": "derived"
  },
  {
   "metric_id": "origins_forbidden",
   "label": "Origini in stato forbidden",
   "value": 21,
   "unit": "count",
   "classification": "derived"
  },
  {
   "metric_id": "origins_outside_model",
   "label": "Origini in stato outside_model",
   "value": 0,
   "unit": "count",
   "classification": "derived"
  },
  {
   "metric_id": "served_share_10min",
   "label": "Quota di origini (tutte) raggiunte entro 10 minuti",
   "value": 0.6021,
   "unit": "1",
   "classification": "estimated",
   "scope": "dst_school_piee82101p, 1.33 m/s, snapping 40 m, soglia 10 min",
   "uncertainty": {
    "kind": "interval",
    "low": 0.1942,
    "high": 0.6515,
    "basis": "sensibilità velocità 0,8-1,4 m/s a parità di percorso"
   }
  },
  {
   "metric_id": "travel_time_p50",
   "label": "Tempo mediano delle origini raggiungibili",
   "value": 8.7,
   "unit": "min",
   "classification": "estimated",
   "scope": "dst_school_piee82101p, 1.33 m/s, snapping 40 m",
   "uncertainty": {
    "kind": "interval",
    "low": 8.27,
    "high": 14.46,
    "basis": "sensibilità velocità 0,8-1,4 m/s a parità di percorso"
   }
  },
  {
   "metric_id": "travel_time_p90",
   "label": "Tempo 90° percentile delle origini raggiungibili",
   "value": 14.11,
   "unit": "min",
   "classification": "estimated",
   "scope": "dst_school_piee82101p, 1.33 m/s, snapping 40 m",
   "uncertainty": {
    "kind": "interval",
    "low": 13.4,
    "high": 23.46,
    "basis": "sensibilità velocità 0,8-1,4 m/s a parità di percorso"
   }
  },
  {
   "metric_id": "network_distance_p50",
   "label": "Distanza di cammino mediana (rete più raccordi)",
   "value": 694.5,
   "unit": "m",
   "classification": "derived",
   "scope": "dst_school_piee82101p, 1.33 m/s, snapping 40 m"
  },
  {
   "metric_id": "deviation_p50",
   "label": "Deviazione mediana rispetto alla linea d'aria",
   "value": 1.32,
   "unit": "1",
   "classification": "derived",
   "scope": "dst_school_piee82101p, 1.33 m/s, snapping 40 m, origini oltre 100 m"
  },
  {
   "metric_id": "high_deviation_count",
   "label": "Origini con deviazione alta (rapporto 1,5 o più, oltre 100 m)",
   "value": 400,
   "unit": "count",
   "classification": "derived",
   "scope": "dst_school_piee82101p, 1.33 m/s, snapping 40 m"
  },
  {
   "metric_id": "unknown_sidewalk_share",
   "label": "Quota dei metri di rete a marciapiede ignoto",
   "value": 0.0861,
   "unit": "1",
   "classification": "derived",
   "scope": "dst_school_piee82101p, 1.33 m/s, snapping 40 m"
  }
 ],
 "coverage": {
  "accessibility_counts": {
   "reachable": 2148,
   "isolated": 0,
   "insufficient_data": 55,
   "forbidden": 21,
   "outside_model": 0
  },
  "note": "Le componenti isolate restano nei conteggi."
 },
 "limits": [
  {
   "code": "grafo_osm_non_verificato",
   "text": "Rete da OSM congelato, non verificata sul posto; percorsi, ingressi e restrizioni da controllare al sopralluogo."
  },
  {
   "code": "marciapiede_ignoto",
   "text": "Dove il marciapiede non è taggato lo stato è ignoto: il tratto è percorribile ma non certificato."
  },
  {
   "code": "civici_non_residenti",
   "text": "I civici SIT sono punti d'indirizzo, non residenti: le quote sono quote di civici, non di popolazione. Licenza SIT non provata: solo uso interno."
  },
  {
   "code": "velocita_ipotesi",
   "text": "Velocità e penalità sono ipotesi di esperimento, non misure su Pisa e non attribuite a gruppi di persone."
  },
  {
   "code": "snapping_parametro",
   "text": "Il limite di snapping e il raccordo non attraversano edifici; i civici non agganciati restano insufficient_data."
  },
  {
   "code": "no_certificazione_accessibilita",
   "text": "Mancano pendenze, larghezze, rampe e gradini di marciapiede: nessuna certificazione di accessibilità universale."
  },
  {
   "code": "ingresso_da_verificare",
   "text": "Ingresso e orari della destinazione non verificati; cambiare ingresso può cambiare lunghezze e attraversamenti."
  }
 ],
 "validation_status": "not_validated_locally",
 "assets": [
  {
   "asset_id": "ast_origini_csv",
   "path": "service/cache/job_1c6073bfb883f3f5/job_1c6073bfb883f3f5_origini.csv",
   "media_type": "text/csv",
   "bytes": 229501,
   "sha256": "ecbcd09cddf32c0710ecda6297ec715123e9d44387e9280bbfc9839cd0957443",
   "role": "result_table"
  },
  {
   "asset_id": "ast_archi_usati",
   "path": "service/cache/job_1c6073bfb883f3f5/job_1c6073bfb883f3f5_archi_usati.geojson",
   "media_type": "application/geo+json",
   "bytes": 23055,
   "sha256": "fe2fd1bb02a7f3f09ebe0e7902c0af938c426495bebf68e0663d41d76857d2fc",
   "role": "result_geometry"
  },
  {
   "asset_id": "ast_report",
   "path": "service/cache/job_1c6073bfb883f3f5/job_1c6073bfb883f3f5_report.json",
   "media_type": "application/json",
   "bytes": 8855,
   "sha256": "ccf37fbf0ff24a5e7128393c35e1011b36fc33956ee5929e33ee2dce5d365495",
   "role": "report"
  }
 ]
}