{
 "manifest_id": "man_5e468c969536aed1",
 "job_id": "job_5e468c969536aed1",
 "tool": "compute_shadow",
 "aoi_id": "aoi_z2",
 "baseline_id": "bas_z2_20261001",
 "datasets": [
  {
   "snapshot_id": "snp_osm_pisa_20261001",
   "source_id": "src_osm_pisa",
   "sha256": "69d65bfc52e0daf14ccd57fee67216af9b91d747cdb79841ec2337a2f2b086f5",
   "license_state": "clear"
  },
  {
   "snapshot_id": "snp_rt_dbt10k_pisa_20261001",
   "source_id": "src_rt_dbt10k_pisa",
   "sha256": "63bb7e264dafd87351c960af5fe546f103f71b5cfc421896530434dadac0b14f",
   "license_state": "clear"
  },
  {
   "snapshot_id": "snp_rt_dsm2021_20261001",
   "source_id": "src_rt_dsm2021",
   "sha256": "88ef7aed9a0890777788abb958b118fb5268a26f79c26167b826b25fe59ec4c2",
   "license_state": "clear_with_reserve"
  },
  {
   "snapshot_id": "snp_rt_dtm10_20261001",
   "source_id": "src_rt_dtm10",
   "sha256": "4d6a4f8c1cc9ff8a87b30b4c08ba3b15aa68659db78f483eb6a06e8e33b7b36b",
   "license_state": "clear_with_reserve"
  },
  {
   "snapshot_id": "snp_rt_unita_volumetriche_20261001",
   "source_id": "src_rt_unita_volumetriche",
   "sha256": "0d2397b5d1195b278edf8a3dceac9f81ed9039a48842f7dca3be39d17ec86223",
   "license_state": "clear_with_reserve"
  }
 ],
 "params": {
  "receivers": [
   {
    "receiver_id": "pth_t04_R01",
    "kind": "path",
    "geometry": {
     "coordinates": [
      [
       612592.17,
       4840664.0
      ],
      [
       612593.82,
       4840663.88
      ],
      [
       612593.49,
       4840659.38
      ],
      [
       612593.13,
       4840654.67
      ],
      [
       612598.27,
       4840652.05
      ],
      [
       612597.36,
       4840658.11
      ],
      [
       612601.5,
       4840653.17
      ],
      [
       612606.38,
       4840648.76
      ],
      [
       612612.72,
       4840643.99
      ],
      [
       612616.58,
       4840642.83
      ],
      [
       612619.57,
       4840640.79
      ],
      [
       612621.84,
       4840637.97
      ],
      [
       612623.19,
       4840634.62
      ],
      [
       612623.51,
       4840631.03
      ],
      [
       612627.68,
       4840628.1
      ],
      [
       612634.04,
       4840624.39
      ],
      [
       612638.79,
       4840622.25
      ],
      [
       612646.68,
       4840619.3
      ],
      [
       612658.73,
       4840615.39
      ],
      [
       612677.77,
       4840612.87
      ],
      [
       612686.45,
       4840611.86
      ],
      [
       612692.76,
       4840610.8
      ],
      [
       612692.31,
       4840608.43
      ],
      [
       612692.42,
       4840605.95
      ],
      [
       612693.49,
       4840602.83
      ],
      [
       612694.75,
       4840600.96
      ],
      [
       612696.4,
       4840599.42
      ],
      [
       612698.53,
       4840597.96
      ],
      [
       612700.96,
       4840597.31
      ],
      [
       612703.39,
       4840597.16
      ],
      [
       612700.44,
       4840577.12
      ],
      [
       612693.47,
       4840540.37
      ],
      [
       612690.27,
       4840522.12
      ],
      [
       612689.81,
       4840517.64
      ],
      [
       612690.47,
       4840513.54
      ],
      [
       612692.25,
       4840510.92
      ],
      [
       612694.32,
       4840508.97
      ],
      [
       612701.66,
       4840505.43
      ],
      [
       612712.24,
       4840500.53
      ],
      [
       612721.23,
       4840496.48
      ],
      [
       612744.7,
       4840485.85
      ],
      [
       612753.91,
       4840481.89
      ],
      [
       612767.85,
       4840475.96
      ],
      [
       612801.06,
       4840461.27
      ],
      [
       612806.69,
       4840458.6
      ],
      [
       612864.63,
       4840431.07
      ],
      [
       612904.46,
       4840412.52
      ],
      [
       612924.99,
       4840401.82
      ],
      [
       612930.02,
       4840399.18
      ],
      [
       613062.79,
       4840336.85
      ],
      [
       613068.89,
       4840334.19
      ],
      [
       613073.85,
       4840331.94
      ],
      [
       613075.98,
       4840336.54
      ],
      [
       613076.25,
       4840337.12
      ],
      [
       613152.26,
       4840301.94
      ],
      [
       613152.54,
       4840302.55
      ]
     ],
     "type": "LineString"
    }
   }
  ],
  "when": {
   "date": "2026-09-15",
   "timezone": "Europe/Rome",
   "times": [
    "08:00",
    "13:00",
    "16:30"
   ]
  },
  "method": {
   "name": "geometric_ray",
   "space_step_m": 2,
   "time_step_min": 10,
   "obstacles": "buildings_and_trees"
  },
  "walk_speed_m_s": 1.2,
  "casi": [
   "base",
   "base_h_min",
   "base_h_max",
   "alberi_min",
   "alberi_tipico",
   "alberi_max"
  ],
  "fasce": [],
  "el_min_deg": 5.0,
  "sun_reference_lonlat": [
   10.4006,
   43.7087
  ],
  "geometrie_sha256": "416410ce6c7674d6af9354f613928d031efdc9b715d10ce108b65ed87d2d8216",
  "chiome": {
   "forma": "ellissoide",
   "tronco": "trascurato",
   "parametri": "geometry/parametri_chiome.json"
  },
  "sospesi": "coperture OSM (building=roof) sospese, base = tetto - 0,4 m (0,2-0,8 m) come scene/build.py; portici ignoti trattati come pieni",
  "method_version": "0.2.0"
 },
 "method": {
  "name": "geometric_ray",
  "version": "0.2.0",
  "description": "Sole con algoritmo astronomico NOAA in Europe/Rome; ombra di ogni volume come somma di Minkowski del footprint con il segmento fra quota di base e di tetto; chiome come ellissoidi opachi; unione di tutte le ombre e intersezione con il ricevitore."
 },
 "crs": "EPSG:7791",
 "vertical_datum_status": "not_confirmed",
 "timezone": "Europe/Rome",
 "timing": {
  "started_at": "2026-10-01T20:31:15Z",
  "finished_at": "2026-10-01T20:31:18Z",
  "duration_s": 2.84
 },
 "metrics": [
  {
   "metric_id": "pth_t04_r01_tutti_shade_fraction_base",
   "label": "Frazione ombreggiata, edifici documentati",
   "value": 0.6852,
   "unit": "1",
   "classification": "derived",
   "scope": "pth_t04_R01, 2026-09-15, fascia tutti, centerline",
   "uncertainty": {
    "kind": "interval",
    "low": 0.674,
    "high": 0.6887,
    "basis": "sensibilità altezze: intervallo h_min/h_max di T05 (±0,5 m measured, ±1,36 m derived)"
   }
  },
  {
   "metric_id": "pth_t04_r01_tutti_shade_fraction_alberi",
   "label": "Frazione ombreggiata, edifici + chiome idealizzate",
   "value": 0.6915,
   "unit": "1",
   "classification": "estimated",
   "scope": "pth_t04_R01, 2026-09-15, fascia tutti, centerline, chioma tipica",
   "uncertainty": {
    "kind": "interval",
    "low": 0.6852,
    "high": 0.7286,
    "basis": "chiome min/tipico/max da parametri_chiome.json: classi stimate, non misurate"
   }
  },
  {
   "metric_id": "pth_t04_r01_tutti_walk_sun_min_base",
   "label": "Minuti al sole camminando, edifici documentati",
   "value": 3.303,
   "unit": "min",
   "classification": "derived",
   "scope": "pth_t04_R01, 2026-09-15, fascia tutti, centerline",
   "uncertainty": {
    "kind": "interval",
    "low": 3.257,
    "high": 3.405,
    "basis": "sensibilità altezze: intervallo h_min/h_max di T05 (±0,5 m measured, ±1,36 m derived)"
   }
  },
  {
   "metric_id": "pth_t04_r01_tutti_walk_sun_min_alberi",
   "label": "Minuti al sole camminando, edifici + chiome idealizzate",
   "value": 3.238,
   "unit": "min",
   "classification": "estimated",
   "scope": "pth_t04_R01, 2026-09-15, fascia tutti, centerline, chioma tipica",
   "uncertainty": {
    "kind": "interval",
    "low": 2.831,
    "high": 3.303,
    "basis": "chiome min/tipico/max da parametri_chiome.json: classi stimate, non misurate"
   }
  }
 ],
 "coverage": {
  "note": "Calcoli 18 di 18 (ricevitore, ora, caso); stati del sole: {'ok': 18}. Volumi 3228, alberi 1128."
 },
 "limits": [
  {
   "code": "terreno_piano",
   "text": "Terreno quasi piano dichiarato: ogni volume riferito al proprio piede (quota base di fonte), ricevitore alla quota dei piedi vicini; dislivelli locali non modellati."
  },
  {
   "code": "centerline",
   "text": "Percorsi sull'asse della rete OSM, non sul lato del marciapiede: lato e portici non noti (marciapiede ignoto), l'effetto del lato non è nel risultato."
  },
  {
   "code": "volumi_sospesi_ignoti",
   "text": "Coperture OSM trattate come volumi sospesi (soletta 0,4 m, stima 0,2-0,8 m, come la scena); il campo sospeso dei portici delle unità volumetriche è ignoto: trattati come pieni (limite superiore dell'ombra al suolo)."
  },
  {
   "code": "alberi_solo_stimati",
   "text": "Chiome idealizzate opache (ellissoide) con parametri stimati per classe; tronco trascurato; inventario incompleto (462 gruppi di vegetazione DSM senza albero puntuale): non è l'ombra reale degli alberi."
  },
  {
   "code": "ombra_binaria",
   "text": "Ombra geometrica binaria: nessuna trasmissività, nessuna conversione in temperatura, comfort o domanda pedonale."
  },
  {
   "code": "altezze_non_indipendenti",
   "text": "Altezze delle unità volumetriche 2010 e DSM 2021 non indipendenti; datum verticale non confermato; edifici post-2010 solo da OSM più DSM."
  },
  {
   "code": "sole_geometrico",
   "text": "Sole NOAA senza rifrazione; sotto 5.0 gradi di elevazione il contesto dei dati non copre le ombre lunghe: istanti esclusi con stato esplicito."
  },
  {
   "code": "non_validato",
   "text": "Nessuna osservazione di campo: risultato non validato localmente."
  },
  {
   "code": "camminata_velocita",
   "text": "Minuti al sole a velocità costante 1.2 m/s (ipotesi, nessun attraversamento o attesa); istante di ogni punto = partenza + distanza/velocità, agganciato al passo temporale."
  },
  {
   "code": "alberi_esclusi",
   "text": "Esclusi 3 alberi con posizione dentro un edificio; 4 volumi senza altezza o quota base scartati."
  }
 ],
 "validation_status": "not_validated_locally",
 "assets": []
}